### ISSUE TITLE
docker pull failed with `connection reset by peer` or `i/o timeout`

### ISSUE THREAD

**Issue by leomao10** [microsoft/containerregistry#144]
Hi there,

I am Leo Liang from bitbucket pipeline team have had several users report failures trying to pull images from `mcr.microsoft.com`. We done some analysis of our logs and have found a combination of "connection reset by peer" and "i/o timeout" errors talking to both mcr.microsoft.com and eastus.data.mcr.microsoft.com. 

The majority of errors are for mcr.microsoft.com, and mainly happen in our node in AWS `us-east-1` region, and it constantly happen and we don't see abnormal spike of error rate. 

Here is one of the tcp dump we capture from one of the failing build:
```
17:57:25.224404 IP 0cdf910b-4c56-4622-8622-3fccc7cbf3c5-nx7hm.57338 > 204.79.197.219.443: Flags [S], seq 2044995150, win 64240, options [mss 1460,sackOK,TS val 4164622281 ecr 0,nop,wscale 7], length 0
17:57:25.226511 IP 204.79.197.219.443 > 0cdf910b-4c56-4622-8622-3fccc7cbf3c5-nx7hm.57338: Flags [S.], seq 496447486, ack 2044995151, win 65535, options [mss 1440,nop,wscale 8,nop,nop,sackOK], length 0
17:57:25.226533 IP 0cdf910b-4c56-4622-8622-3fccc7cbf3c5-nx7hm.57338 > 204.79.197.219.443: Flags [.], ack 1, win 502, length 0
17:57:25.226802 IP 0cdf910b-4c56-4622-8622-3fccc7cbf3c5-nx7hm.57338 > 204.79.197.219.443: Flags [P.], seq 1:250, ack 1, win 502, length 249
17:57:25.228257 IP 204.79.197.219.443 > 0cdf910b-4c56-4622-8622-3fccc7cbf3c5-nx7hm.57338: Flags [.], ack 250, win 16384, length 0
17:57:25.229435 IP 204.79.197.219.443 > 0cdf910b-4c56-4622-8622-3fccc7cbf3c5-nx7hm.57338: Flags [P.], seq 1:5929, ack 250, win 16384, length 5928
17:57:25.229455 IP 0cdf910b-4c56-4622-8622-3fccc7cbf3c5-nx7hm.57338 > 204.79.197.219.443: Flags [.], ack 5929, win 456, length 0
17:57:25.233892 IP 0cdf910b-4c56-4622-8622-3fccc7cbf3c5-nx7hm.57338 > 204.79.197.219.443: Flags [P.], seq 250:408, ack 5929, win 501, length 158
17:57:25.234814 IP 204.79.197.219.443 > 0cdf910b-4c56-4622-8622-3fccc7cbf3c5-nx7hm.57338: Flags [R], seq 496453415, win 0, length 0
```

Base on our understanding:
- It started ok when Pipelines started the handshake and Microsoft acknowledged it as well
- On the initial push of data from Pipelines, it was also acknowledged by Microsoft (see sequence 1:250)
- However, after the second push of data from Pipelines (see sequence 250:408), it was not acknowledged by Microsoft but immediately terminated instead with the [R] flag which means the connection is reset/terminated abruptly. (see sequence 496453415)

Do you aware any existing networking issue between AWS and `mcr.microsoft.com`?

**Comment by leomao10** [comment]
One thing we notice is all the failed events for last 7 days are related to ip `204.79.197.219:443`

And we noticed there are similar networking issue mentioned this ip address, not sure if they are related :
https://github.com/microsoft/containerregistry/issues/139
https://github.com/dotnet/core/issues/8268

**Comment by Stanols** [comment]
Dockerfile:9
--------------------
   7 |     
   8 |     # Dockerfile for backend image
   9 | >>> FROM mcr.microsoft.com/dotnet/sdk:6.0 AS build
  10 |     
  11 |     
--------------------
ERROR: failed to solve: mcr.microsoft.com/dotnet/sdk:6.0: failed to copy: httpReadSeeker: failed open: unexpected status code https://mcr.microsoft.com/v2/dotnet/sdk/blobs/sha256:c998ae9ecc920b5f674da908d8f10462f3b30209c06c12cccffdd637a1bd8e96: 503 Service Unavailable

**Comment by akhtar-h-m** [comment]
We are seeing similar issues on the last few days. Seems to fail maybe 25% of the time, so could be so load balanced node behind the ip that isat issue and if you just happened to hit it, then it doesn't work. Some of builds are trying to pull multiple times, so the overall builds fail a lot as it doesn't consitsently work across the whole build

**Comment by AndreHamilton-MSFT** [comment]
@leomao10  The connection reset and connection timeouts probably represent different issues. We are currently investigating timeout related issues in east us region and will update once we know more. Also can you share what region you are seeing timeouts in?

**Comment by AndreHamilton-MSFT** [comment]
@akhtar-h-m and @devopshangikredi we are actively looking into this. Can you share a bit about which regions you are noticing this degradation in.

**Comment by akhtar-h-m** [comment]
@AndreHamilton-MSFT we are seeing this on our builds that are running on AWS nodes in eu-west-1, and also locally in UK

**Comment by AndreHamilton-MSFT** [comment]
Still debugging, The connection reset may be related to some any cast routing and we are still investigating. I think we identified one cause of long delays have been identified and we have identified a mitigation. Will update  once its deployed

**Comment by AndreHamilton-MSFT** [comment]
@akhtar-h-m is it possible for you to collect a tcp dump and share. Could you include the times of the failures(we get too many request  so need timeline to narrow). Is it possible for you to modify your useragent string so we can easily identify your traffic from others?

**Comment by akhtar-h-m** [comment]
@AndreHamilton-MSFT I've asked our infra team for logs. Will get back to you as soon as we can with that. Otherwise I can give you a particular time 10-Oct-2023 13:20:49 (UTC +1) .Our ip address will be either one of 52.50.194.92, 52.215.230.58

**Comment by AndreHamilton-MSFT** [comment]
@akhtar-h-m were these just connection resets or did you also experience timeouts. Can you also give me a succesfful timestamp. Thanks again

**Comment by jmcdade11** [comment]
Similar issue on Azure North Central US while using Azure Container Registry Task build functionality:

dial tcp: lookup mcr.microsoft.com: i/o timeout
2024/01/16 21:04:47

**Comment by AndreHamilton-MSFT** [comment]
Sorry for delays in this. We were working on ways to better isolate this kind of issue. Are folks still experiencing tcp timeouts and if so from where?

**Comment by asgmojtaba** [comment]
> Sorry for delays in this. We were working on ways to better isolate this kind of issue. Are folks still experiencing tcp timeouts and if so from where?

Yeah, I have just faced it with following error (from Iran):

```
docker pull mcr.microsoft.com/mssql/server:2022-latest

Error response from daemon: Head "https://mcr.microsoft.com/v2/mssql/server/manifests/2022-latest": read tcp *.*.*.39:39838->204.79.197.219:443: read: connection reset by peer
```

**Comment by WellyngtonF** [comment]
Hey, im facing the same issue right now in Brazil.

```
docker pull mcr.microsoft.com/dotnet/sdk:8.0
 
Error response from daemon: Get "https://mcr.microsoft.com/v2/": dial tcp: lookup mcr.microsoft.com on *.*.*.1:53: read udp 172.30.170.107:46691->172.30.160.1:53: i/o timeout```

**Comment by AndreHamilton-MSFT** [comment]
You should be seeing improvements related to this now

**Comment by lucasassisrosa** [comment]
Facing the same issue now. Created issue #165

**Comment by martinalderson** [comment]
Hi, we are seeing the same problem on bb pipelines. We've always had very occasional failures with this but nothing too bad. 

Yesterday it got extremely bad. Curiously this seems also to be the time nuget has started having problems, we are hit badly with both. https://status.nuget.org/
